{
  "format": "AIL_PLUGIN_V1",
  "schema_version": 1,
  "plugin_id": "plugin.lab.skin.black",
  "version": "1.0.0",
  "api": { "target": 1, "min": 1 },
  "display": {
    "name": "Black Skin",
    "description": "黑色皮肤验证插件：启用后将 Plugin Lab 全局切换为纯黑深色主题。"
  },
  "roles": ["skin"],
  "activation": { "mode": "hot" },
  "runtime": { "kind": "declarative", "entry": "runtime.json" },
  "dependencies": { "plugins": [], "services": [] },
  "permissions": { "requested_scopes": [] },
  "provides": {
    "capabilities": [],
    "services": [],
    "providers": [],
    "extensions": [
      { "point": "ai_limbs.ui.theme", "id": "plugin.lab.skin.black.theme", "api": 1 }
    ]
  }
}
